[
 {
  "card": "ERR-RB2",
  "slug": "err-rb2",
  "hypothesis_id": "H-err-qwen",
  "statement": "internal features beat the exposed seen-pair margin at predicting held-out RB2 completion errors on Qwen3-8B",
  "metric": "err_auroc_delta_qwen8b",
  "comparator": ">",
  "threshold": 0.03,
  "registered_prob": 0.6,
  "interval_prediction": null,
  "observed": -0.0009738428193937221,
  "outcome": "refuted",
  "kill_id": "K-err",
  "inconclusive_reason": null,
  "science": "S16-robustness"
 },
 {
  "card": "ERR-RB2",
  "slug": "err-rb2",
  "hypothesis_id": "H-err-llama",
  "statement": "the same holds on Llama-8B (cross-family)",
  "metric": "err_auroc_delta_llama8b",
  "comparator": ">",
  "threshold": 0.03,
  "registered_prob": null,
  "interval_prediction": null,
  "observed": -0.003470736845503808,
  "outcome": "refuted",
  "kill_id": "K-err",
  "inconclusive_reason": null,
  "science": "S16-robustness"
 },
 {
  "card": "FORECAST-CAT",
  "slug": "forecast-cat",
  "hypothesis_id": "H-forecast-mae",
  "statement": "internals plus a 200-pair slice forecast per-category RB2 accuracy within 0.06 MAE",
  "metric": "forecast_mae",
  "comparator": "<",
  "threshold": 0.06,
  "registered_prob": 0.55,
  "interval_prediction": null,
  "observed": 0.08695840679817465,
  "outcome": "refuted",
  "kill_id": null,
  "inconclusive_reason": null,
  "science": "S16-robustness"
 },
 {
  "card": "FORECAST-CAT",
  "slug": "forecast-cat",
  "hypothesis_id": "H-forecast-beats-size",
  "statement": "the forecast beats predict-from-size",
  "metric": "forecast_mae_minus_size_baseline",
  "comparator": "<",
  "threshold": 0.0,
  "registered_prob": null,
  "interval_prediction": null,
  "observed": -0.10242024172821523,
  "outcome": "confirmed",
  "kill_id": null,
  "inconclusive_reason": null,
  "science": "S16-robustness"
 },
 {
  "card": "STYLE-RMB",
  "slug": "style-rmb",
  "hypothesis_id": "H-style-transfer",
  "statement": "internal style susceptibility predicts the fleet's RM-Bench Hard ranking",
  "metric": "spearman_biasbattery_vs_rmbench_hard",
  "comparator": ">",
  "threshold": 0.6,
  "registered_prob": 0.5,
  "interval_prediction": null,
  "observed": null,
  "outcome": "inconclusive",
  "kill_id": null,
  "inconclusive_reason": "missing intermediate: no intermediate 'campaign.bias.battery' for roster_key='armorm' slice='diagnostic-v3-degradation'; the arc that produces it has not run or its shard was not merged",
  "science": "S16-robustness"
 },
 {
  "card": "STYLE-RMB",
  "slug": "style-rmb",
  "hypothesis_id": "H-style-perm",
  "statement": "the fleet-level correlation clears its permutation null",
  "metric": "biasbattery_rmbench_perm_p",
  "comparator": "<",
  "threshold": 0.05,
  "registered_prob": null,
  "interval_prediction": null,
  "observed": null,
  "outcome": "inconclusive",
  "kill_id": null,
  "inconclusive_reason": "missing intermediate: no intermediate 'campaign.bias.battery' for roster_key='armorm' slice='diagnostic-v3-degradation'; the arc that produces it has not run or its shard was not merged",
  "science": "S16-robustness"
 },
 {
  "card": "STYLE-RMB",
  "slug": "style-rmb",
  "hypothesis_id": "H-style-baseline",
  "statement": "the internal battery at least matches the behavioral degradation baseline",
  "metric": "spearman_minus_behavioral_baseline",
  "comparator": ">=",
  "threshold": 0.0,
  "registered_prob": null,
  "interval_prediction": null,
  "observed": null,
  "outcome": "inconclusive",
  "kill_id": null,
  "inconclusive_reason": "missing intermediate: no intermediate 'campaign.bias.battery' for roster_key='armorm' slice='diagnostic-v3-degradation'; the arc that produces it has not run or its shard was not merged",
  "science": "S16-robustness"
 },
 {
  "card": "PPE-BON",
  "slug": "ppe-bon",
  "hypothesis_id": "H-tail-plateau",
  "statement": "the tail index predicts where best-of-k stops helping on the five PPE verifiable sets",
  "metric": "spearman_tail_vs_bon_plateau",
  "comparator": ">",
  "threshold": 0.3,
  "registered_prob": 0.55,
  "interval_prediction": null,
  "observed": null,
  "outcome": "inconclusive",
  "kill_id": null,
  "inconclusive_reason": "missing intermediate: no intermediate 'campaign.scores' for roster_key='skywork-v2-qwen3-8b' slice='ppe-best-of-k::gpqa'; the arc that produces it has not run or its shard was not merged",
  "science": "S03-thermo"
 },
 {
  "card": "PPE-BON",
  "slug": "ppe-bon",
  "hypothesis_id": "H-lowerquantile",
  "statement": "the lower-quantile best-of-n aggregation beats the mean against human labels, reproducing the PPE finding",
  "metric": "bon_lowerquantile_beats_mean",
  "comparator": "==",
  "threshold": 1.0,
  "registered_prob": null,
  "interval_prediction": null,
  "observed": null,
  "outcome": "inconclusive",
  "kill_id": null,
  "inconclusive_reason": "missing intermediate: no intermediate 'campaign.scores' for roster_key='skywork-v2-qwen3-8b' slice='ppe-best-of-k::gpqa'; the arc that produces it has not run or its shard was not merged",
  "science": "S03-thermo"
 },
 {
  "card": "LADDER",
  "slug": "ladder",
  "hypothesis_id": "H-ladder-coverage",
  "statement": "at least 2 of 3 capture-only internal quantities land in their pre-frozen 8B intervals",
  "metric": "ladder_8b_metrics_in_interval",
  "comparator": ">=",
  "threshold": 2.0,
  "registered_prob": 0.65,
  "interval_prediction": null,
  "observed": 3.0,
  "outcome": "confirmed",
  "kill_id": null,
  "inconclusive_reason": null,
  "science": "S03-thermo"
 },
 {
  "card": "LADDER",
  "slug": "ladder",
  "hypothesis_id": "H-ladder-beats-flat",
  "statement": "the extrapolation beats a no-trend (equal-to-4B) baseline",
  "metric": "ladder_extrap_minus_flat_error",
  "comparator": "<",
  "threshold": 0.0,
  "registered_prob": null,
  "interval_prediction": null,
  "observed": 0.6002275013086775,
  "outcome": "refuted",
  "kill_id": null,
  "inconclusive_reason": null,
  "science": "S03-thermo"
 },
 {
  "card": "CHI-DRIFT",
  "slug": "chi-drift",
  "hypothesis_id": "H-chi-bon",
  "statement": "chi predicts realized best-of-n feature-drift ordering on a real bank",
  "metric": "chi_bon_spearman",
  "comparator": ">",
  "threshold": 0.3,
  "registered_prob": 0.6,
  "interval_prediction": null,
  "observed": 0.9642857142857145,
  "outcome": "confirmed",
  "kill_id": null,
  "inconclusive_reason": null,
  "science": "S03-thermo"
 },
 {
  "card": "CHI-DRIFT",
  "slug": "chi-drift",
  "hypothesis_id": "H-chi-beats-var",
  "statement": "chi beats a base-variance-only baseline",
  "metric": "chi_minus_variance_baseline_spearman",
  "comparator": ">",
  "threshold": 0.0,
  "registered_prob": null,
  "interval_prediction": null,
  "observed": 0.5714285714285714,
  "outcome": "confirmed",
  "kill_id": null,
  "inconclusive_reason": null,
  "science": "S03-thermo"
 },
 {
  "card": "HUMP",
  "slug": "hump",
  "hypothesis_id": "H-hump-exists",
  "statement": "an interior gold-reward hump exists in the proxy/gold best-of-n arm",
  "metric": "hump_interior_present",
  "comparator": "==",
  "threshold": 1.0,
  "registered_prob": 0.55,
  "interval_prediction": null,
  "observed": null,
  "outcome": "inconclusive",
  "kill_id": null,
  "inconclusive_reason": "missing intermediate: no intermediate 'campaign.recorder.drift' for roster_key='policy-qwen25-1.5b' slice='hump-prompts'; the arc that produces it has not run or its shard was not merged",
  "science": "S03-thermo"
 },
 {
  "card": "HUMP",
  "slug": "hump",
  "hypothesis_id": "H-hump-loc",
  "statement": "the tail-predicted hump location matches the observed one within 0.5 nats",
  "metric": "hump_kl_abs_error",
  "comparator": "<",
  "threshold": 0.5,
  "registered_prob": null,
  "interval_prediction": true,
  "observed": null,
  "outcome": "inconclusive",
  "kill_id": null,
  "inconclusive_reason": "missing intermediate: no intermediate 'campaign.recorder.drift' for roster_key='policy-qwen25-1.5b' slice='hump-prompts'; the arc that produces it has not run or its shard was not merged",
  "science": "S03-thermo"
 },
 {
  "card": "GAUGE-E19",
  "slug": "gauge-e19",
  "hypothesis_id": "H-raw",
  "statement": "the raw cross-fine-tune reward cosine reproduces the v1 fixture near 0.005",
  "metric": "raw_cos_v01_v02",
  "comparator": "abs<",
  "threshold": 0.02,
  "registered_prob": 0.9,
  "interval_prediction": null,
  "observed": null,
  "outcome": "inconclusive",
  "kill_id": null,
  "inconclusive_reason": "resolve_subjects failed: PermissionError(13, 'Permission denied')",
  "science": "S02-gauge"
 },
 {
  "card": "GAUGE-E19",
  "slug": "gauge-e19",
  "hypothesis_id": "H-canon",
  "statement": "the frame-fixed cosine is far larger than the raw cosine (co-rotation)",
  "metric": "canonical_minus_raw",
  "comparator": ">",
  "threshold": 0.4,
  "registered_prob": null,
  "interval_prediction": null,
  "observed": null,
  "outcome": "inconclusive",
  "kill_id": null,
  "inconclusive_reason": "resolve_subjects failed: PermissionError(13, 'Permission denied')",
  "science": "S02-gauge"
 },
 {
  "card": "GAUGE-E19",
  "slug": "gauge-e19",
  "hypothesis_id": "H-localize",
  "statement": "the top residual-angle concept matches the largest behavioral delta (formality)",
  "metric": "residual_concept_matches_top_behavioral_delta",
  "comparator": "==",
  "threshold": 1.0,
  "registered_prob": null,
  "interval_prediction": null,
  "observed": null,
  "outcome": "inconclusive",
  "kill_id": null,
  "inconclusive_reason": "resolve_subjects failed: PermissionError(13, 'Permission denied')",
  "science": "S02-gauge"
 },
 {
  "card": "GAUGE-XFAM",
  "slug": "gauge-xfam",
  "hypothesis_id": "H-xfam",
  "statement": "the canonical angle between two RMs' reward directions predicts their held-out disagreement rate",
  "metric": "spearman_canonical_angle_vs_disagreement",
  "comparator": ">",
  "threshold": 0.6,
  "registered_prob": 0.5,
  "interval_prediction": null,
  "observed": null,
  "outcome": "inconclusive",
  "kill_id": null,